{
  "schema": "athyper.compiled-entity-artifact/2.0-draft",
  "schemaVersion": 2,
  "contractStatus": "draft_for_review",
  "artifactType": "presentation_surface",
  "artifactKey": "business_partner/presentation.list",
  "entityCode": "business_partner",
  "plane": "neon",
  "surfaceKey": "list",
  "columns": [
    "code",
    "name",
    "registration_country_code",
    "status"
  ],
  "sort": [
    {
      "field": "name",
      "direction": "asc"
    }
  ],
  "pageSizes": [
    25,
    50,
    100
  ],
  "actions": [
    {
      "operationKey": "request_change",
      "placement": "primary",
      "interaction": "start_flow"
    }
  ],
  "dependencies": [
    "business_partner/core"
  ],
  "artifactHash": "sha256:e4b2668e2e06d45964446a336add09f662d1ee949da4d86b37f7ef41be7b9af4"
}
